"title","link","description","pub_date"
"Tesla Cuts Model Y Output in China – Economic Slowdown and Anticipated Project Juniper Launch - Not a Tesla App","https://news.google.com/rss/articles/CBMiggFodHRwczovL3d3dy5ub3RhdGVzbGFhcHAuY29tL25ld3MvMjA0NC90ZXNsYS1jdXRzLW1vZGVsLXktb3V0cHV0LWluLWNoaW5hLWVjb25vbWljLXNsb3dkb3duLWFuZC1hbnRpY2lwYXRlZC1wcm9qZWN0LWp1bmlwZXItbGF1bmNo0gEA?oc=5","Tesla Cuts Model Y Output in China – Economic Slowdown and Anticipated Project Juniper Launch  Not a Tesla App","Wed, 29 May 2024 15:08:00 GMT"
"I just drove 100 miles in the Ford Mach-E GT — Tesla Model Y has some serious competition - Tom's Guide","https://news.google.com/rss/articles/CBMiggFodHRwczovL3d3dy50b21zZ3VpZGUuY29tL3ZlaGljbGUtdGVjaC9ldnMvaS1qdXN0LWRyb3ZlLTEwMC1taWxlcy1pbi10aGUtZm9yZC1tYWNoLWUtZ3QtdGVzbGEtbW9kZWwteS1oYXMtc29tZS1zZXJpb3VzLWNvbXBldGl0aW9u0gEA?oc=5","I just drove 100 miles in the Ford Mach-E GT — Tesla Model Y has some serious competition  Tom's Guide","Wed, 29 May 2024 08:30:57 GMT"
"I just swapped a Tesla Model 3 for a Model Y and Elon Musk's brutal layoffs ruined the experience - Electrek","https://news.google.com/rss/articles/CBMiR2h0dHBzOi8vZWxlY3RyZWsuY28vMjAyNC8wNS8yNy90ZXNsYS1tb2RlbC0zLW1vZGVsLXktZWxvbi1tdXNrLWxheW9mZnMv0gEA?oc=5","I just swapped a Tesla Model 3 for a Model Y and Elon Musk's brutal layoffs ruined the experience  Electrek","Mon, 27 May 2024 23:18:00 GMT"
"Rendering: All-New 2025 Tesla Model Y Comes Whacky With Curious DNA, Albeit Only in CGI - autoevolution","https://news.google.com/rss/articles/CBMihAFodHRwczovL3d3dy5hdXRvZXZvbHV0aW9uLmNvbS9uZXdzL3JlbmRlcmluZy1hbGwtbmV3LTIwMjUtdGVzbGEtbW9kZWwteS1jb21lcy13aGFja3ktd2l0aC1jdXJpb3VzLWRuYS1hbGJlaXQtb25seS1pbi1jZ2ktMjM0NDc1Lmh0bWzSAQA?oc=5","Rendering: All-New 2025 Tesla Model Y Comes Whacky With Curious DNA, Albeit Only in CGI  autoevolution","Mon, 27 May 2024 07:51:26 GMT"
"Tesla cuts Model Y output in China - electrive.com - www.electrive.com","https://news.google.com/rss/articles/CBMiRWh0dHBzOi8vd3d3LmVsZWN0cml2ZS5jb20vMjAyNC8wNS8yNy90ZXNsYS1jdXRzLW1vZGVsLXktb3V0cHV0LWNoaW5hL9IBAA?oc=5","Tesla cuts Model Y output in China - electrive.com  www.electrive.com","Mon, 27 May 2024 07:31:27 GMT"
"New Cadillac Optiq Costs More Than Tesla Model Y Performance, Might Be DOA-IQ - CarScoops","https://news.google.com/rss/articles/CBMia2h0dHBzOi8vd3d3LmNhcnNjb29wcy5jb20vMjAyNC8wNS9jYWRpbGxhYy1vcHRpcS1jb3N0cy1tb3JlLXRoYW4tdGVzbGEtbW9kZWwteS1wZXJmb3JtYW5jZS1taWdodC1iZS1kb2EtaXEv0gEA?oc=5","New Cadillac Optiq Costs More Than Tesla Model Y Performance, Might Be DOA-IQ  CarScoops","Wed, 29 May 2024 18:05:23 GMT"
"Kia EV3 vs Tesla Model Y: Can Kia’s new entry-level car take on Tesla? - Digital Trends","https://news.google.com/rss/articles/CBMiZ2h0dHBzOi8vd3d3LmRpZ2l0YWx0cmVuZHMuY29tL2NhcnMva2lhLWV2My12cy10ZXNsYS1tb2RlbC15LWNhbi1raWFzLW5ldy1lbnRyeS1sZXZlbC1jYXItdGFrZS1vbi10ZXNsYS_SAWtodHRwczovL3d3dy5kaWdpdGFsdHJlbmRzLmNvbS9jYXJzL2tpYS1ldjMtdnMtdGVzbGEtbW9kZWwteS1jYW4ta2lhcy1uZXctZW50cnktbGV2ZWwtY2FyLXRha2Utb24tdGVzbGEvP2FtcA?oc=5","Kia EV3 vs Tesla Model Y: Can Kia’s new entry-level car take on Tesla?  Digital Trends","Tue, 28 May 2024 18:00:14 GMT"
"Tesla software limits Model 3 and Model Y power and acceleration to price them cheaper - Notebookcheck.net","https://news.google.com/rss/articles/CBMiggFodHRwczovL3d3dy5ub3RlYm9va2NoZWNrLm5ldC9UZXNsYS1zb2Z0d2FyZS1saW1pdHMtTW9kZWwtMy1hbmQtTW9kZWwtWS1wb3dlci1hbmQtYWNjZWxlcmF0aW9uLXRvLXByaWNlLXRoZW0tY2hlYXBlci44NDE3ODguMC5odG1s0gEA?oc=5","Tesla software limits Model 3 and Model Y power and acceleration to price them cheaper  Notebookcheck.net","Tue, 28 May 2024 10:39:33 GMT"
"5 Million US Solar Installations, Low Tesla Model Y Interest Rates, New Electric Cars — Top Cleantech News - CleanTechnica","https://news.google.com/rss/articles/CBMijAFodHRwczovL2NsZWFudGVjaG5pY2EuY29tLzIwMjQvMDUvMjgvNS1taWxsaW9uLXVzLXNvbGFyLWluc3RhbGxhdGlvbnMtbG93LXRlc2xhLW1vZGVsLXktaW50ZXJlc3QtcmF0ZXMtbmV3LWVsZWN0cmljLWNhcnMtdG9wLWNsZWFudGVjaC1uZXdzL9IBkAFodHRwczovL2NsZWFudGVjaG5pY2EuY29tLzIwMjQvMDUvMjgvNS1taWxsaW9uLXVzLXNvbGFyLWluc3RhbGxhdGlvbnMtbG93LXRlc2xhLW1vZGVsLXktaW50ZXJlc3QtcmF0ZXMtbmV3LWVsZWN0cmljLWNhcnMtdG9wLWNsZWFudGVjaC1uZXdzL2FtcC8?oc=5","5 Million US Solar Installations, Low Tesla Model Y Interest Rates, New Electric Cars — Top Cleantech News  CleanTechnica","Wed, 29 May 2024 04:07:24 GMT"
"Tesla to launch new Performance mode for Model 3 and Y - TESLARATI","https://news.google.com/rss/articles/CBMiO2h0dHBzOi8vd3d3LnRlc2xhcmF0aS5jb20vdGVzbGEtcGVyZm9ybWFuY2UtbW9kZS1tb2RlbC0zLXkv0gE_aHR0cHM6Ly93d3cudGVzbGFyYXRpLmNvbS90ZXNsYS1wZXJmb3JtYW5jZS1tb2RlLW1vZGVsLTMteS9hbXAv?oc=5","Tesla to launch new Performance mode for Model 3 and Y  TESLARATI","Sun, 26 May 2024 23:26:15 GMT"
"Tesla Model Y Performance stands against Jeep Wagoneer S EV in new ad - TESLARATI","https://news.google.com/rss/articles/CBMiUGh0dHBzOi8vd3d3LnRlc2xhcmF0aS5jb20vdGVzbGEtbW9kZWwteS1wZXJmb3JtYW5jZS12cy1qZWVwLXdhZ29uZWVyLXMtZXYtdmlkZW8v0gFUaHR0cHM6Ly93d3cudGVzbGFyYXRpLmNvbS90ZXNsYS1tb2RlbC15LXBlcmZvcm1hbmNlLXZzLWplZXAtd2Fnb25lZXItcy1ldi12aWRlby9hbXAv?oc=5","Tesla Model Y Performance stands against Jeep Wagoneer S EV in new ad  TESLARATI","Mon, 27 May 2024 03:35:16 GMT"
"Used Tesla Model Y Demand Surges As Price Drops - Forbes","https://news.google.com/rss/articles/CBMiZ2h0dHBzOi8vd3d3LmZvcmJlcy5jb20vc2l0ZXMvYnJvb2tlY3JvdGhlcnMvMjAyNC8wNS8xOS91c2VkLXRlc2xhLW1vZGVsLXktZGVtYW5kLXN1cmdlcy1hcy1wcmljZS1kcm9wcy_SAQA?oc=5","Used Tesla Model Y Demand Surges As Price Drops  Forbes","Sun, 19 May 2024 07:00:00 GMT"
"Nio's ONVO Wants To Bury Tesla's Model Y With the Brand-New L60 - autoevolution","https://news.google.com/rss/articles/CBMibmh0dHBzOi8vd3d3LmF1dG9ldm9sdXRpb24uY29tL25ld3MvbmlvLXMtb252by13YW50cy10by1idXJ5LXRlc2xhLXMtbW9kZWwteS13aXRoLXRoZS1icmFuZC1uZXctbDYwLTIzNDY0My5odG1s0gEA?oc=5","Nio's ONVO Wants To Bury Tesla's Model Y With the Brand-New L60  autoevolution","Wed, 29 May 2024 21:38:41 GMT"
"Tesla slashes Model Y production in Shanghai, data shows - Reuters","https://news.google.com/rss/articles/CBMidmh0dHBzOi8vd3d3LnJldXRlcnMuY29tL2J1c2luZXNzL2F1dG9zLXRyYW5zcG9ydGF0aW9uL3Rlc2xhLXNsYXNoZXMtbW9kZWwteS1wcm9kdWN0aW9uLXNoYW5naGFpLWRhdGEtc2hvd3MtMjAyNC0wNS0yNC_SAQA?oc=5","Tesla slashes Model Y production in Shanghai, data shows  Reuters","Fri, 24 May 2024 11:08:00 GMT"
"Tesla Reportedly Cuts Output of Best-Selling Model Y in Shanghai - Investopedia","https://news.google.com/rss/articles/CBMiR2h0dHBzOi8vd3d3LmludmVzdG9wZWRpYS5jb20vdGVzbGEtY3V0cy1vdXRwdXQtbW9kZWwteS1zaGFuZ2hhaS04NjUzNTM10gEA?oc=5","Tesla Reportedly Cuts Output of Best-Selling Model Y in Shanghai  Investopedia","Fri, 24 May 2024 17:45:09 GMT"
"Tesla cuts Model Y production in China as brutal price war hits demand: report - MarketWatch","https://news.google.com/rss/articles/CBMie2h0dHBzOi8vd3d3Lm1hcmtldHdhdGNoLmNvbS9zdG9yeS90ZXNsYS1jdXRzLXByb2R1Y3Rpb24tb2YtbW9kZWwteS1pbi1jaGluYS1hcy1icnV0YWwtcHJpY2Utd2FyLWhpdHMtZGVtYW5kLXJlcG9ydC1mYjExYmRlOdIBf2h0dHBzOi8vd3d3Lm1hcmtldHdhdGNoLmNvbS9hbXAvc3RvcnkvdGVzbGEtY3V0cy1wcm9kdWN0aW9uLW9mLW1vZGVsLXktaW4tY2hpbmEtYXMtYnJ1dGFsLXByaWNlLXdhci1oaXRzLWRlbWFuZC1yZXBvcnQtZmIxMWJkZTk?oc=5","Tesla cuts Model Y production in China as brutal price war hits demand: report  MarketWatch","Fri, 24 May 2024 08:32:00 GMT"
"Kia's New EV3 Electric SUV Takes Aim at the Tesla Model 3 - Road & Track","https://news.google.com/rss/articles/CBMiTGh0dHBzOi8vd3d3LnJvYWRhbmR0cmFjay5jb20vbmV3cy9hNjA4ODMxNTkva2lhLWV2My1hZmZvcmRhYmxlLWVsZWN0cmljLXN1di_SAQA?oc=5","Kia's New EV3 Electric SUV Takes Aim at the Tesla Model 3  Road & Track","Thu, 23 May 2024 15:29:00 GMT"
"Tesla Slashes Model Y Production Amid Shrinking Market Share In China - CarScoops","https://news.google.com/rss/articles/CBMiXGh0dHBzOi8vd3d3LmNhcnNjb29wcy5jb20vMjAyNC8wNS90ZXNsYS1oYXMtc2xhc2hlZC1tb2RlbC15LXByb2R1Y3Rpb24tYXQtaXRzLWNoaW5lc2UtcGxhbnQv0gEA?oc=5","Tesla Slashes Model Y Production Amid Shrinking Market Share In China  CarScoops","Tue, 28 May 2024 15:58:58 GMT"
"Tesla Firmware Hints at Software-Capped Model 3 and Model Y Variants - autoevolution","https://news.google.com/rss/articles/CBMic2h0dHBzOi8vd3d3LmF1dG9ldm9sdXRpb24uY29tL25ld3MvdGVzbGEtZmlybXdhcmUtaGludHMtYXQtc29mdHdhcmUtY2FwcGVkLW1vZGVsLTMtYW5kLW1vZGVsLXktdmFyaWFudHMtMjM0NTE3Lmh0bWzSAQA?oc=5","Tesla Firmware Hints at Software-Capped Model 3 and Model Y Variants  autoevolution","Mon, 27 May 2024 17:00:33 GMT"
"Avatr 07 Revealed As Yet Another Chinese EV Looking To Shock Tesla Model Y - CarScoops","https://news.google.com/rss/articles/CBMid2h0dHBzOi8vd3d3LmNhcnNjb29wcy5jb20vMjAyNC8wNS9hdmF0ci0wNy1lbWVyZ2VzLWFzLWxhdGVzdC1ldi1hbmQtZXJldi1tb2RlbC15LXJpdmFsLWZyb20tY2hhbmdhbi1jYXRsLWpvaW50LXZlbnR1cmUv0gEA?oc=5","Avatr 07 Revealed As Yet Another Chinese EV Looking To Shock Tesla Model Y  CarScoops","Wed, 29 May 2024 00:11:15 GMT"
"New Longer-Range Tesla Model Y Keeps Competitive Price And Lease - Forbes","https://news.google.com/rss/articles/CBMicGh0dHBzOi8vd3d3LmZvcmJlcy5jb20vc2l0ZXMvYnJvb2tlY3JvdGhlcnMvMjAyNC8wNS8wNS9sb25nZXItcmFuZ2UtdGVzbGEtbW9kZWwteS1rZWVwcy1jb21wZXRpdGl2ZS1wcmljZS1sZWFzZS_SAQA?oc=5","New Longer-Range Tesla Model Y Keeps Competitive Price And Lease  Forbes","Sun, 05 May 2024 07:00:00 GMT"
"Tesla China planned to cut Model Y production by at least 20% in March-June: Reuters - TESLARATI","https://news.google.com/rss/articles/CBMiX2h0dHBzOi8vd3d3LnRlc2xhcmF0aS5jb20vdGVzbGEtY2hpbmEtcGxhbm5lZC1jdXQtbW9kZWwteS1vdXRwdXQtMjAtcGVyY2VudC1tYXJjaC1qdW5lLXJldXRlcnMv0gFjaHR0cHM6Ly93d3cudGVzbGFyYXRpLmNvbS90ZXNsYS1jaGluYS1wbGFubmVkLWN1dC1tb2RlbC15LW91dHB1dC0yMC1wZXJjZW50LW1hcmNoLWp1bmUtcmV1dGVycy9hbXAv?oc=5","Tesla China planned to cut Model Y production by at least 20% in March-June: Reuters  TESLARATI","Fri, 24 May 2024 12:44:18 GMT"
"Tesla’s 0.99% APR Financing For Tesla Model Y Stirring Up Consumer Demand (+ Chevy Equinox EV Potential & Hot Volvo EX30) - CleanTechnica","https://news.google.com/rss/articles/CBMibWh0dHBzOi8vY2xlYW50ZWNobmljYS5jb20vMjAyNC8wNS8yMC90ZXNsYXMtMC05OS1hcHItZmluYW5jaW5nLWZvci10ZXNsYS1tb2RlbC15LXN0aXJyaW5nLXVwLWNvbnN1bWVyLWRlbWFuZC_SAXFodHRwczovL2NsZWFudGVjaG5pY2EuY29tLzIwMjQvMDUvMjAvdGVzbGFzLTAtOTktYXByLWZpbmFuY2luZy1mb3ItdGVzbGEtbW9kZWwteS1zdGlycmluZy11cC1jb25zdW1lci1kZW1hbmQvYW1wLw?oc=5","Tesla’s 0.99% APR Financing For Tesla Model Y Stirring Up Consumer Demand (+ Chevy Equinox EV Potential & Hot Volvo EX30)  CleanTechnica","Mon, 20 May 2024 07:00:00 GMT"
"Tesla Reveals Model Y Has Extra Range—If You Pay for It - Autoweek","https://news.google.com/rss/articles/CBMiSmh0dHBzOi8vd3d3LmF1dG93ZWVrLmNvbS9uZXdzL2E2MDY5OTk2MS8yMDI0LXRlc2xhLW1vZGVsLXktbG9uZy1yYW5nZS1yd2Qv0gEA?oc=5","Tesla Reveals Model Y Has Extra Range—If You Pay for It  Autoweek","Mon, 06 May 2024 07:00:00 GMT"
"Chevrolet Equinox EV vs. Tesla Model Y - CarsDirect","https://news.google.com/rss/articles/CBMiTGh0dHBzOi8vd3d3LmNhcnNkaXJlY3QuY29tL2NvbXBhcmUvc3V2L2NoZXZyb2xldC1lcXVpbm94LWV2LXZzLXRlc2xhLW1vZGVsLXnSAQA?oc=5","Chevrolet Equinox EV vs. Tesla Model Y  CarsDirect","Wed, 29 May 2024 01:07:58 GMT"
"Tesla Slowed Down Model Y Production, What's Happening to the World's Best-Selling Car? - autoevolution","https://news.google.com/rss/articles/CBMihAFodHRwczovL3d3dy5hdXRvZXZvbHV0aW9uLmNvbS9uZXdzL3Rlc2xhLXNsb3dlZC1kb3duLW1vZGVsLXktcHJvZHVjdGlvbi13aGF0LXMtaGFwcGVuaW5nLXRvLXRoZS13b3JsZC1zLWJlc3Qtc2VsbGluZy1jYXItMjM0NDIzLmh0bWzSAQA?oc=5","Tesla Slowed Down Model Y Production, What's Happening to the World's Best-Selling Car?  autoevolution","Sat, 25 May 2024 21:04:07 GMT"
"Jeep compares electric Wagoneer S to Tesla's Model Y in new teaser video - Electrek.co","https://news.google.com/rss/articles/CBMiWWh0dHBzOi8vZWxlY3RyZWsuY28vMjAyNC8wNS8yMi9qZWVwLWNvbXBhcmVzLWVsZWN0cmljLXdhZ29uZWVyLXMtdGVzbGEtbW9kZWwteS1uZXctdmlkZW8v0gEA?oc=5","Jeep compares electric Wagoneer S to Tesla's Model Y in new teaser video  Electrek.co","Wed, 22 May 2024 15:39:00 GMT"
"Here's How Much A 1-Year-Old Tesla Model Y Costs - TopSpeed","https://news.google.com/rss/articles/CBMiQWh0dHBzOi8vd3d3LnRvcHNwZWVkLmNvbS9ob3ctbXVjaC0xLXllYXItb2xkLXRlc2xhLW1vZGVsLXktY29zdHMv0gEA?oc=5","Here's How Much A 1-Year-Old Tesla Model Y Costs  TopSpeed","Sat, 25 May 2024 12:00:00 GMT"
"NIO undercuts Tesla Model Y with new $30,000 Onvo brand EV - Electrek.co","https://news.google.com/rss/articles/CBMiU2h0dHBzOi8vZWxlY3RyZWsuY28vMjAyNC8wNS8xNS9uaW8tdW5kZXJjdXRzLXRlc2xhLW1vZGVsLXktbmV3LTMwMDAwLW9udm8tYnJhbmQtZXYv0gEA?oc=5","NIO undercuts Tesla Model Y with new $30,000 Onvo brand EV  Electrek.co","Wed, 15 May 2024 07:00:00 GMT"
"Tesla cancels cheapest Model Y, adds Long Range version - Green Car Reports","https://news.google.com/rss/articles/CBMiY2h0dHBzOi8vd3d3LmdyZWVuY2FycmVwb3J0cy5jb20vbmV3cy8xMTQzMDc5X3Rlc2xhLWNhbmNlbHMtY2hlYXBlc3QtbW9kZWwteS1hZGRzLWxvbmctcmFuZ2UtdmVyc2lvbtIBAA?oc=5","Tesla cancels cheapest Model Y, adds Long Range version  Green Car Reports","Sat, 04 May 2024 07:00:00 GMT"
"The Sub-$30,000 Chevy Equinox EV Is America's Most Important Electric Car Since The Tesla Model Y - The Autopian","https://news.google.com/rss/articles/CBMihQJodHRwczovL3d3dy50aGVhdXRvcGlhbi5jb20vdGhlLXN1Yi0zMDAwMC1jaGV2eS1lcXVpbm94LWV2LWlzLWFtZXJpY2FzLW1vc3QtaW1wb3J0YW50LWVsZWN0cmljLWNhci1zaW5jZS10aGUtdGVzbGEtbW9kZWwteS8_dXRtX3NvdXJjZT1yc3MmdXRtX21lZGl1bT1yc3MmdXRtX2NhbXBhaWduPXRoZS1zdWItMzAwMDAtY2hldnktZXF1aW5veC1ldi1pcy1hbWVyaWNhcy1tb3N0LWltcG9ydGFudC1lbGVjdHJpYy1jYXItc2luY2UtdGhlLXRlc2xhLW1vZGVsLXnSAQA?oc=5","The Sub-$30,000 Chevy Equinox EV Is America's Most Important Electric Car Since The Tesla Model Y  The Autopian","Wed, 29 May 2024 18:53:01 GMT"
"Tesla axes cheapest Model Y – but now there's a longer range one for $2k more - Electrek.co","https://news.google.com/rss/articles/CBMiZ2h0dHBzOi8vZWxlY3RyZWsuY28vMjAyNC8wNS8wNC90aGUtY2hlYXBlc3QtbW9kZWwteS1pcy1uby1tb3JlLXRlc2xhLWludHJvZHVjZXMtbG9uZy1yYW5nZS1yd2QtZm9yLTQ0ay_SAQA?oc=5","Tesla axes cheapest Model Y – but now there's a longer range one for $2k more  Electrek.co","Sat, 04 May 2024 07:00:00 GMT"
"Tesla Model Y built in Germany spotted with Hardware 4 - TESLARATI","https://news.google.com/rss/articles/CBMiTGh0dHBzOi8vd3d3LnRlc2xhcmF0aS5jb20vdGVzbGEtbW9kZWwteS1idWlsdC1pbi1nZXJtYW55LXNwb3R0ZWQtaGFyZHdhcmUtNC_SAVBodHRwczovL3d3dy50ZXNsYXJhdGkuY29tL3Rlc2xhLW1vZGVsLXktYnVpbHQtaW4tZ2VybWFueS1zcG90dGVkLWhhcmR3YXJlLTQvYW1wLw?oc=5","Tesla Model Y built in Germany spotted with Hardware 4  TESLARATI","Thu, 16 May 2024 07:00:00 GMT"
"Chinese electric car maker Nio unveils rival to Tesla's Model Y - BBC.com","https://news.google.com/rss/articles/CBMiLmh0dHBzOi8vd3d3LmJiYy5jb20vbmV3cy9hcnRpY2xlcy9ja3I1cm1nMGQ1OG_SATJodHRwczovL3d3dy5iYmMuY29tL25ld3MvYXJ0aWNsZXMvY2tyNXJtZzBkNThvLmFtcA?oc=5","Chinese electric car maker Nio unveils rival to Tesla's Model Y  BBC.com","Wed, 15 May 2024 07:00:00 GMT"
"2024 Jeep Wagoneer S EV: Tesla Model Y rival set for May 30 reveal - Green Car Reports","https://news.google.com/rss/articles/CBMiX2h0dHBzOi8vd3d3LmdyZWVuY2FycmVwb3J0cy5jb20vbmV3cy8xMTQzMjU3XzIwMjQtamVlcC13YWdvbmVlci1zLWV2LXRlc2xhLW1vZGVsLXktcml2YWwtdGVhc2Vy0gEA?oc=5","2024 Jeep Wagoneer S EV: Tesla Model Y rival set for May 30 reveal  Green Car Reports","Thu, 23 May 2024 14:00:00 GMT"
"This was the best-selling car in California in 2023 — and it’s not even close - KRON4","https://news.google.com/rss/articles/CBMicWh0dHBzOi8vd3d3Lmtyb240LmNvbS9uZXdzL2NhbGlmb3JuaWEvdGhpcy13YXMtdGhlLWJlc3Qtc2VsbGluZy1jYXItaW4tY2FsaWZvcm5pYS1pbi0yMDIzLWFuZC1pdHMtbm90LWV2ZW4tY2xvc2Uv0gF1aHR0cHM6Ly93d3cua3JvbjQuY29tL25ld3MvY2FsaWZvcm5pYS90aGlzLXdhcy10aGUtYmVzdC1zZWxsaW5nLWNhci1pbi1jYWxpZm9ybmlhLWluLTIwMjMtYW5kLWl0cy1ub3QtZXZlbi1jbG9zZS9hbXAv?oc=5","This was the best-selling car in California in 2023 — and it’s not even close  KRON4","Thu, 02 May 2024 07:00:00 GMT"
"Are the Tesla Model Y's Third-Row Seats Worth It? - MotorTrend","https://news.google.com/rss/articles/CBMiZGh0dHBzOi8vd3d3Lm1vdG9ydHJlbmQuY29tL3Jldmlld3MvMjAyNC10ZXNsYS1tb2RlbC15LWxvbmctcmFuZ2UteWVhcmxvbmctcmV2aWV3LXVwZGF0ZS00LXRoaXJkLXJvdy_SAQA?oc=5","Are the Tesla Model Y's Third-Row Seats Worth It?  MotorTrend","Mon, 06 May 2024 07:00:00 GMT"
"Tesla reportedly cuts Model Y production at Shanghai plant - Yahoo Finance","https://news.google.com/rss/articles/CBMiTGh0dHBzOi8vZmluYW5jZS55YWhvby5jb20vdmlkZW8vdGVzbGEtcmVwb3J0ZWRseS1jdXRzLW1vZGVsLXktMTMzOTAxNTgwLmh0bWzSAQA?oc=5","Tesla reportedly cuts Model Y production at Shanghai plant  Yahoo Finance","Fri, 24 May 2024 13:39:01 GMT"
"Tesla plans to charge some Model Y owners to unlock more range - The Verge","https://news.google.com/rss/articles/CBMiWWh0dHBzOi8vd3d3LnRoZXZlcmdlLmNvbS8yMDI0LzUvNS8yNDE0OTQ0Ny90ZXNsYS1tb2RlbC15LXNvZnR3YXJlLWxvY2tlZC1iYXR0ZXJ5LWNhcGFjaXR50gEA?oc=5","Tesla plans to charge some Model Y owners to unlock more range  The Verge","Sun, 05 May 2024 07:00:00 GMT"
"BYD launches Tesla Model Y rivaling Sea Lion 07 starting at $26K - Electrek.co","https://news.google.com/rss/articles/CBMiXGh0dHBzOi8vZWxlY3RyZWsuY28vMjAyNC8wNS8xMy9ieWQtbGF1bmNoZXMtdGVzbGEtbW9kZWwteS1yaXZhbGluZy1zZWEtbGlvbi0wNy1zdGFydGluZy0yNmsv0gEA?oc=5","BYD launches Tesla Model Y rivaling Sea Lion 07 starting at $26K  Electrek.co","Mon, 13 May 2024 07:00:00 GMT"
"Tesla Model S and Model X get the new Lunar Silver paint option (pics, prices) - Tesla Oracle - Elon Musk, Tesla, SpaceX News","https://news.google.com/rss/articles/CBMiZ2h0dHBzOi8vd3d3LnRlc2xhb3JhY2xlLmNvbS8yMDI0LzA1LzI1L3Rlc2xhLW1vZGVsLXMtYW5kLW1vZGVsLXgtZ2V0LXRoZS1uZXctbHVuYXItc2lsdmVyLXBhaW50LW9wdGlvbi_SAQA?oc=5","Tesla Model S and Model X get the new Lunar Silver paint option (pics, prices)  Tesla Oracle - Elon Musk, Tesla, SpaceX News","Sat, 25 May 2024 15:48:01 GMT"
"0.99% APR: Another Reason Why The Tesla Model Y Is The 'Smart' Buy If You Want A New EV - The Autopian","https://news.google.com/rss/articles/CBMidWh0dHBzOi8vd3d3LnRoZWF1dG9waWFuLmNvbS8wLTk5LWFwci1hbm90aGVyLXJlYXNvbi13aHktdGhlLXRlc2xhLW1vZGVsLXktaXMtdGhlLW9ubHktc21hcnQtYnV5LWlmLXlvdS13YW50LWEtbmV3LWV2L9IBAA?oc=5","0.99% APR: Another Reason Why The Tesla Model Y Is The 'Smart' Buy If You Want A New EV  The Autopian","Sun, 12 May 2024 07:00:00 GMT"
"Tesla cuts Model Y production in China as EV demand slows - Quartz","https://news.google.com/rss/articles/CBMiT2h0dHBzOi8vcXouY29tL3Rlc2xhLXByb2R1Y3Rpb24tY3V0cy1ldnMtbW9kZWwteS1jaGluYS1iaWRlbi10YXJpZmZzLTE4NTE0OTg3MjjSAQA?oc=5","Tesla cuts Model Y production in China as EV demand slows  Quartz","Tue, 28 May 2024 14:43:00 GMT"
"Tesla Slashes Production Of Model Y In China - AutoSpies Auto News - AutoSpies.com","https://news.google.com/rss/articles/CBMiPWh0dHBzOi8vd3d3LmF1dG9zcGllcy5jb20vbmV3cy9pbmRleC5hc3B4P3N1Ym1pc3Npb25pZD0xMjE1MDXSAQA?oc=5","Tesla Slashes Production Of Model Y In China - AutoSpies Auto News  AutoSpies.com","Tue, 28 May 2024 17:12:50 GMT"
"Here is a possible rendering of the Tesla Model Y Juniper - Tesla Magazine","https://news.google.com/rss/articles/CBMiV2h0dHBzOi8vd3d3LnRlc2xhLW1hZy5jb20vZW4vaGVyZS1pcy1hLXBvc3NpYmxlLXJlbmRlcmluZy1vZi10aGUtdGVzbGEtbW9kZWwteS1qdW5pcGVyL9IBAA?oc=5","Here is a possible rendering of the Tesla Model Y Juniper  Tesla Magazine","Wed, 22 May 2024 19:51:58 GMT"
"2024 Tesla Model Y APR Deal Makes It $9k Cheaper Than Model 3 - Carsdirect - CarsDirect","https://news.google.com/rss/articles/CBMiZmh0dHBzOi8vd3d3LmNhcnNkaXJlY3QuY29tL2RlYWxzLWFydGljbGVzLzIwMjQtdGVzbGEtbW9kZWwteS1hcHItZGVhbC1tYWtlcy1pdC05ay1jaGVhcGVyLXRoYW4tbW9kZWwtM9IBAA?oc=5","2024 Tesla Model Y APR Deal Makes It $9k Cheaper Than Model 3 - Carsdirect  CarsDirect","Mon, 13 May 2024 07:00:00 GMT"
"Want more range on your Tesla Model Y? You might have to pay extra to unlock it - TechRadar","https://news.google.com/rss/articles/CBMijgFodHRwczovL3d3dy50ZWNocmFkYXIuY29tL3ZlaGljbGUtdGVjaC9oeWJyaWQtZWxlY3RyaWMtdmVoaWNsZXMvd2FudC1tb3JlLXJhbmdlLW9uLXlvdXItdGVzbGEtbW9kZWwteS15b3UtbWlnaHQtaGF2ZS10by1wYXktZXh0cmEtdG8tdW5sb2NrLWl00gEA?oc=5","Want more range on your Tesla Model Y? You might have to pay extra to unlock it  TechRadar","Tue, 07 May 2024 07:00:00 GMT"
"Tesla Model Y Cheaper Than Ever in USA - CleanTechnica","https://news.google.com/rss/articles/CBMiTGh0dHBzOi8vY2xlYW50ZWNobmljYS5jb20vMjAyNC8wNC8yMC90ZXNsYS1tb2RlbC15LWNoZWFwZXItdGhhbi1ldmVyLWluLXVzYS_SAVBodHRwczovL2NsZWFudGVjaG5pY2EuY29tLzIwMjQvMDQvMjAvdGVzbGEtbW9kZWwteS1jaGVhcGVyLXRoYW4tZXZlci1pbi11c2EvYW1wLw?oc=5","Tesla Model Y Cheaper Than Ever in USA  CleanTechnica","Sat, 20 Apr 2024 07:00:00 GMT"
"Tesla cuts Model Y production in Shanghai: Reuters - Investing.com","https://news.google.com/rss/articles/CBMicGh0dHBzOi8vd3d3LmludmVzdGluZy5jb20vbmV3cy9zdG9jay1tYXJrZXQtbmV3cy90ZXNsYS1jdXRzLW1vZGVsLXktcHJvZHVjdGlvbi1pbi1zaGFuZ2hhaS1yZXV0ZXJzLTQzMlNJLTM0NTYzMTHSAQA?oc=5","Tesla cuts Model Y production in Shanghai: Reuters  Investing.com","Fri, 24 May 2024 13:56:34 GMT"
"What a Week Commuting in a Tesla Model Y Looks Like - Cars.com","https://news.google.com/rss/articles/CBMiWWh0dHBzOi8vd3d3LmNhcnMuY29tL2FydGljbGVzL3doYXQtYS13ZWVrLWNvbW11dGluZy1pbi1hLXRlc2xhLW1vZGVsLXktbG9va3MtbGlrZS00ODE2OTgv0gFdaHR0cHM6Ly93d3cuY2Fycy5jb20vYW1wL2FydGljbGVzL3doYXQtYS13ZWVrLWNvbW11dGluZy1pbi1hLXRlc2xhLW1vZGVsLXktbG9va3MtbGlrZS00ODE2OTgv?oc=5","What a Week Commuting in a Tesla Model Y Looks Like  Cars.com","Thu, 25 Apr 2024 07:00:00 GMT"
"Elon Musk reveals Tesla software-locked cheapest Model Y, offers 40-60 more miles of range - Electrek.co","https://news.google.com/rss/articles/CBMicGh0dHBzOi8vZWxlY3RyZWsuY28vMjAyNC8wNS8wNC9lbG9uLW11c2stcmV2ZWFscy10ZXNsYS1zb2Z0d2FyZS1sb2NrZWQtY2hlYXBlc3QtbW9kZWwteS1vZmZlcnMtbW9yZS1taWxlcy1yYW5nZS_SAQA?oc=5","Elon Musk reveals Tesla software-locked cheapest Model Y, offers 40-60 more miles of range  Electrek.co","Sat, 04 May 2024 07:00:00 GMT"
"The Tesla Model Y is at its lowest price yet — but should you buy one? - Digital Trends","https://news.google.com/rss/articles/CBMiZ2h0dHBzOi8vd3d3LmRpZ2l0YWx0cmVuZHMuY29tL2NhcnMvdGhlLXRlc2xhLW1vZGVsLXktaXMtYXQtaXRzLWxvd2VzdC1wcmljZS15ZXQtYnV0LXNob3VsZC15b3UtYnV5LW9uZS_SAWtodHRwczovL3d3dy5kaWdpdGFsdHJlbmRzLmNvbS9jYXJzL3RoZS10ZXNsYS1tb2RlbC15LWlzLWF0LWl0cy1sb3dlc3QtcHJpY2UteWV0LWJ1dC1zaG91bGQteW91LWJ1eS1vbmUvP2FtcA?oc=5","The Tesla Model Y is at its lowest price yet — but should you buy one?  Digital Trends","Fri, 26 Apr 2024 07:00:00 GMT"
"Hard Lesson As Used Electric Vehicle Prices Crash: Tesla Model Y, Model 3 And Chevy Bolt At CarMax - Forbes","https://news.google.com/rss/articles/CBMimAFodHRwczovL3d3dy5mb3JiZXMuY29tL3NpdGVzL2Jyb29rZWNyb3RoZXJzLzIwMjQvMDIvMDQvaGFyZC1sZXNzb24tYXMtdXNlZC1lbGVjdHJpYy12ZWhpY2xlLXByaWNlcy1jcmFzaC10ZXNsYS1tb2RlbC15LW1vZGVsLTMtYW5kLWNoZXZ5LWJvbHQtYXQtY2FybWF4L9IBAA?oc=5","Hard Lesson As Used Electric Vehicle Prices Crash: Tesla Model Y, Model 3 And Chevy Bolt At CarMax  Forbes","Sun, 04 Feb 2024 08:00:00 GMT"
"Tesla alters software in models 3 and Y to manage battery longevity - KillerStartups","https://news.google.com/rss/articles/CBMiY2h0dHBzOi8vd3d3LmtpbGxlcnN0YXJ0dXBzLmNvbS90ZXNsYS1hbHRlcnMtc29mdHdhcmUtaW4tbW9kZWxzLTMtYW5kLXktdG8tbWFuYWdlLWJhdHRlcnktbG9uZ2V2aXR5L9IBAA?oc=5","Tesla alters software in models 3 and Y to manage battery longevity  KillerStartups","Wed, 29 May 2024 18:11:08 GMT"
"Tesla's 'full self-driving' remains unfinished. I found out firsthand - USA TODAY","https://news.google.com/rss/articles/CBMiZmh0dHBzOi8vd3d3LnVzYXRvZGF5LmNvbS9zdG9yeS9ncmFwaGljcy8yMDI0LzA1LzAyL3Rlc2xhLWZ1bGwtc2VsZi1kcml2aW5nLW1vZGVsLXktcmV2aWV3LzczMTY4NTQ2MDA3L9IBAA?oc=5","Tesla's 'full self-driving' remains unfinished. I found out firsthand  USA TODAY","Thu, 02 May 2024 07:00:00 GMT"
"Tesla cuts Model Y production in Shanghai by at least 20% in Mar-Jun, report says - CnEVPost","https://news.google.com/rss/articles/CBMiVmh0dHBzOi8vY25ldnBvc3QuY29tLzIwMjQvMDUvMjQvdGVzbGEtY3V0cy1tb2RlbC15LXByb2R1Y3Rpb24tc2hhbmdoYWktbWFyLWp1bi1yZXBvcnQv0gEA?oc=5","Tesla cuts Model Y production in Shanghai by at least 20% in Mar-Jun, report says  CnEVPost","Fri, 24 May 2024 10:03:00 GMT"
"As World Waits For Word On Model 2, Tesla Cuts Model Y Price (Again) - Forbes","https://news.google.com/rss/articles/CBMiemh0dHBzOi8vd3d3LmZvcmJlcy5jb20vc2l0ZXMvYnJvb2tlY3JvdGhlcnMvMjAyNC8wNC8yMS90ZXNsYS1jdXRzLW1vZGVsLXktcHJpY2VzLWFnYWluLWFzLXdvcmxkLXdhaXRzLWZvci13b3JkLW9uLW1vZGVsLTIv0gEA?oc=5","As World Waits For Word On Model 2, Tesla Cuts Model Y Price (Again)  Forbes","Sun, 21 Apr 2024 07:00:00 GMT"
"2025 Tesla Model Y: Everything we know so far about the upgraded rival to the Hyundai Ioniq 5, Kia EV5 and Toyota ... - CarsGuide","https://news.google.com/rss/articles/CBMigAFodHRwczovL3d3dy5jYXJzZ3VpZGUuY29tLmF1L2Nhci1uZXdzLzIwMjUtdGVzbGEtbW9kZWwteS1ldmVyeXRoaW5nLXdlLWtub3ctc28tZmFyLWFib3V0LXRoZS11cGdyYWRlZC1yaXZhbC10by10aGUtaHl1bmRhaS1pb25pcdIBAA?oc=5","2025 Tesla Model Y: Everything we know so far about the upgraded rival to the Hyundai Ioniq 5, Kia EV5 and Toyota ...  CarsGuide","Fri, 24 May 2024 17:09:55 GMT"
"These are the best 2024 Memorial Day EV deals so far - Electrek.co","https://news.google.com/rss/articles/CBMiQWh0dHBzOi8vZWxlY3RyZWsuY28vMjAyNC8wNS8yMy9iZXN0LW1lbW9yaWFsLWRheS1ldi1kZWFscy1zby1mYXIv0gEA?oc=5","These are the best 2024 Memorial Day EV deals so far  Electrek.co","Thu, 23 May 2024 17:08:00 GMT"
"Tesery Expands Its Range of Tesla Accessories, Focusing on Model 3 Highland and Model Y - News Channel Nebraska","https://news.google.com/rss/articles/CBMiiwFodHRwczovL21ldHJvLm5ld3NjaGFubmVsbmVicmFza2EuY29tL3N0b3J5LzUwODQwMTQwL3Rlc2VyeS1leHBhbmRzLWl0cy1yYW5nZS1vZi10ZXNsYS1hY2Nlc3Nvcmllcy1mb2N1c2luZy1vbi1tb2RlbC0zLWhpZ2hsYW5kLWFuZC1tb2RlbC150gEA?oc=5","Tesery Expands Its Range of Tesla Accessories, Focusing on Model 3 Highland and Model Y  News Channel Nebraska","Wed, 29 May 2024 03:32:00 GMT"
