"title","link","description","pub_date"
"Stock market, ether ETF, Tesla Model Y production: 3 Things - Yahoo Finance","https://news.google.com/rss/articles/CBMiS2h0dHBzOi8vZmluYW5jZS55YWhvby5jb20vdmlkZW8vc3RvY2stbWFya2V0LWV0aGVyLWV0Zi10ZXNsYS0xMzIzMDczODguaHRtbNIBAA?oc=5","Stock market, ether ETF, Tesla Model Y production: 3 Things  Yahoo Finance","Fri, 24 May 2024 13:23:07 GMT"
"Tesla announces incredibly low interest rates for new cars purchased by end of May — here's how to take advantage of ... - The Cool Down","https://news.google.com/rss/articles/CBMiUWh0dHBzOi8vd3d3LnRoZWNvb2xkb3duLmNvbS9ncmVlbi1idXNpbmVzcy9tb2RlbC15LXRlc2xhLWZpbmFuY2luZy1tYXktcHJvbW90aW9uL9IBAA?oc=5","Tesla announces incredibly low interest rates for new cars purchased by end of May — here's how to take advantage of ...  The Cool Down","Sun, 19 May 2024 07:00:00 GMT"
"Tesla Model Y And Model 3 Price Cuts Continue As Owners Feel The Pain - Forbes","https://news.google.com/rss/articles/CBMib2h0dHBzOi8vd3d3LmZvcmJlcy5jb20vc2l0ZXMvYnJvb2tlY3JvdGhlcnMvMjAyNC8wNC8wNy90ZXNsYS1tb2RlbC15LW1vZGVsLTMtcHJpY2UtY3V0cy1jb250aW51ZS1mZWVsLXRoZS1wYWluL9IBAA?oc=5","Tesla Model Y And Model 3 Price Cuts Continue As Owners Feel The Pain  Forbes","Mon, 08 Apr 2024 07:00:00 GMT"
"2024 Tesla Model Y vs. 2024 Tesla Model X Comparison - J.D. Power","https://news.google.com/rss/articles/CBMiYGh0dHBzOi8vd3d3LmpkcG93ZXIuY29tL2NhcnMvc2hvcHBpbmctZ3VpZGVzLzIwMjQtdGVzbGEtbW9kZWwteS12cy0yMDI0LXRlc2xhLW1vZGVsLXgtY29tcGFyaXNvbtIBAA?oc=5","2024 Tesla Model Y vs. 2024 Tesla Model X Comparison  J.D. Power","Wed, 01 May 2024 07:00:00 GMT"
"US seeks records from Tesla in power steering loss probe - MSN","https://news.google.com/rss/articles/CBMifWh0dHBzOi8vd3d3Lm1zbi5jb20vZW4tdXMvbW9uZXkvY29tcGFuaWVzL3VzLXNlZWtzLXJlY29yZHMtZnJvbS10ZXNsYS1pbi1wb3dlci1zdGVlcmluZy1sb3NzLXByb2JlL2FyLUJCMW5oZkl2P29jaWQ9c2FtcGxlYXBw0gEA?oc=5","US seeks records from Tesla in power steering loss probe  MSN","Wed, 29 May 2024 18:23:46 GMT"
"Tesla price cut: Model Y undercuts Model 3 by $5,000 with tax credit - Green Car Reports","https://news.google.com/rss/articles/CBMiYWh0dHBzOi8vd3d3LmdyZWVuY2FycmVwb3J0cy5jb20vbmV3cy8xMTQyOTUwX3Rlc2xhLXByaWNlLWN1dC1tb2RlbC15LXVuZGVyY3V0cy1tb2RlbC0zLXRheC1jcmVkaXTSAQA?oc=5","Tesla price cut: Model Y undercuts Model 3 by $5,000 with tax credit  Green Car Reports","Mon, 22 Apr 2024 07:00:00 GMT"
"2024 Ford Mustang Mach-E vs. 2024 Tesla Model Y Comparison - Kelley Blue Book ","https://news.google.com/rss/articles/CBMiRGh0dHBzOi8vd3d3LmtiYi5jb20vY29tcGFyaXNvbi9mb3JkLW11c3RhbmctbWFjaC1lLXZzLXRlc2xhLW1vZGVsLXkv0gEA?oc=5","2024 Ford Mustang Mach-E vs. 2024 Tesla Model Y Comparison  Kelley Blue Book ","Tue, 21 May 2024 15:02:20 GMT"
"Jeep Wagoneer S Squares Off Against Tesla Model Y Performance In New Video - CarScoops","https://news.google.com/rss/articles/CBMibWh0dHBzOi8vd3d3LmNhcnNjb29wcy5jb20vMjAyNC8wNS9qZWVwLXdhZ29uZWVyLXMtc3F1YXJlcy1vZmYtYWdhaW5zdC10ZXNsYS1tb2RlbC15LXBlcmZvcm1hbmNlLWluLW5ldy12aWRlby_SAQA?oc=5","Jeep Wagoneer S Squares Off Against Tesla Model Y Performance In New Video  CarScoops","Wed, 22 May 2024 19:37:58 GMT"
"Car Ratings Car Shopping Guides 2024 Tesla Model Y vs. 2024 Volkswagen ID.4 Comparison - J.D. Power","https://news.google.com/rss/articles/CBMiYmh0dHBzOi8vd3d3LmpkcG93ZXIuY29tL2NhcnMvc2hvcHBpbmctZ3VpZGVzLzIwMjQtdGVzbGEtbW9kZWwteS12cy0yMDI0LXZvbGtzd2FnZW4taWQtNC1jb21wYXJpc29u0gEA?oc=5","Car Ratings Car Shopping Guides 2024 Tesla Model Y vs. 2024 Volkswagen ID.4 Comparison  J.D. Power","Wed, 24 Apr 2024 07:00:00 GMT"
"Tesla Defies Auto Industry Trends With 0.99% APR Model Y Financing Offer - Tesla (NASDAQ:TSLA) - Benzinga","https://news.google.com/rss/articles/CBMidGh0dHBzOi8vd3d3LmJlbnppbmdhLmNvbS9uZXdzLzI0LzA1LzM4Nzk4ODYzL3Rlc2xhLWRlZmllcy1hdXRvLWluZHVzdHJ5LXRyZW5kcy13aXRoLTAtOTktYXByLW1vZGVsLXktZmluYW5jaW5nLW9mZmVy0gEtaHR0cHM6Ly93d3cuYmVuemluZ2EuY29tL2FtcC9jb250ZW50LzM4Nzk4ODYz?oc=5","Tesla Defies Auto Industry Trends With 0.99% APR Model Y Financing Offer - Tesla (NASDAQ:TSLA)  Benzinga","Mon, 13 May 2024 07:00:00 GMT"
"Tesla raises prices of Model Y cars in US by $1000 - Reuters","https://news.google.com/rss/articles/CBMibWh0dHBzOi8vd3d3LnJldXRlcnMuY29tL2J1c2luZXNzL2F1dG9zLXRyYW5zcG9ydGF0aW9uL3Rlc2xhLXJhaXNlcy1wcmljZXMtbW9kZWwteS1jYXJzLXVzLWJ5LTEwMDAtMjAyNC0wNC0wMS_SAQA?oc=5","Tesla raises prices of Model Y cars in US by $1000  Reuters","Mon, 01 Apr 2024 07:00:00 GMT"
"Tesla Cuts Model Y Production Amid Weakening China Demand - Finimize","https://news.google.com/rss/articles/CBMiVmh0dHBzOi8vZmluaW1pemUuY29tL2NvbnRlbnQvdGVzbGEtY3V0cy1tb2RlbC15LXByb2R1Y3Rpb24tYW1pZC13ZWFrZW5pbmctY2hpbmEtZGVtYW5k0gEA?oc=5","Tesla Cuts Model Y Production Amid Weakening China Demand  Finimize","Fri, 24 May 2024 06:59:56 GMT"
"US seeks records from Tesla in power steering loss probe - WKZO","https://news.google.com/rss/articles/CBMiVWh0dHBzOi8vd2t6by5jb20vMjAyNC8wNS8yOS91cy1zZWVrcy1yZWNvcmRzLWZyb20tdGVzbGEtaW4tcG93ZXItc3RlZXJpbmctbG9zcy1wcm9iZS_SAQA?oc=5","US seeks records from Tesla in power steering loss probe  WKZO","Wed, 29 May 2024 17:12:19 GMT"
"Jeep's All-Electric Wagoneer S Beats Tesla Model Y Performance In Acceleration Test, Lags Behind Model X - Benzinga","https://news.google.com/rss/articles/CBMikQFodHRwczovL3d3dy5iZW56aW5nYS5jb20vbmV3cy8yNC8wNS8zOTAwNDM2OS9qZWVwcy1hbGwtZWxlY3RyaWMtd2Fnb25lZXItcy1iZWF0cy10ZXNsYS1tb2RlbC15LXBlcmZvcm1hbmNlLWluLWFjY2VsZXJhdGlvbi10ZXN0LWxhZ3MtYmVoaW5kLW1vZGVs0gEtaHR0cHM6Ly93d3cuYmVuemluZ2EuY29tL2FtcC9jb250ZW50LzM5MDA0MzY5?oc=5","Jeep's All-Electric Wagoneer S Beats Tesla Model Y Performance In Acceleration Test, Lags Behind Model X  Benzinga","Fri, 24 May 2024 10:29:47 GMT"
"Affordable Tesla could be stripped-down versions of Model Y and 3 - electrive.com - www.electrive.com","https://news.google.com/rss/articles/CBMiZ2h0dHBzOi8vd3d3LmVsZWN0cml2ZS5jb20vMjAyNC8wNC8zMC9hZmZvcmRhYmxlLXRlc2xhLWNvdWxkLWJlLXN0cmlwcGVkLWRvd24tdmVyc2lvbnMtb2YtbW9kZWwteS1hbmQtMy_SAQA?oc=5","Affordable Tesla could be stripped-down versions of Model Y and 3 - electrive.com  www.electrive.com","Tue, 30 Apr 2024 07:00:00 GMT"
"Car Ratings Car Shopping Guides 2024 Tesla Model Y vs. 2024 Ford Mustang Mach-E Comparison - J.D. Power","https://news.google.com/rss/articles/CBMiZmh0dHBzOi8vd3d3LmpkcG93ZXIuY29tL2NhcnMvc2hvcHBpbmctZ3VpZGVzLzIwMjQtdGVzbGEtbW9kZWwteS12cy0yMDI0LWZvcmQtbXVzdGFuZy1tYWNoLWUtY29tcGFyaXNvbtIBAA?oc=5","Car Ratings Car Shopping Guides 2024 Tesla Model Y vs. 2024 Ford Mustang Mach-E Comparison  J.D. Power","Fri, 19 Apr 2024 07:00:00 GMT"
"2024 Tesla Model Y vs. 2024 Hyundai Ioniq 5 Comparison - J.D. Power","https://news.google.com/rss/articles/CBMiYmh0dHBzOi8vd3d3LmpkcG93ZXIuY29tL2NhcnMvc2hvcHBpbmctZ3VpZGVzLzIwMjQtdGVzbGEtbW9kZWwteS12cy0yMDI0LWh5dW5kYWktaW9uaXEtNS1jb21wYXJpc29u0gEA?oc=5","2024 Tesla Model Y vs. 2024 Hyundai Ioniq 5 Comparison  J.D. Power","Tue, 30 Apr 2024 07:00:00 GMT"
"6 top accessories for your Tesla Model Y police patrol cars - Police News","https://news.google.com/rss/articles/CBMidWh0dHBzOi8vd3d3LnBvbGljZTEuY29tL3BvbGljZS1wcm9kdWN0cy92ZWhpY2xlLWVxdWlwbWVudC82LXRvcC1hY2Nlc3Nvcmllcy1mb3IteW91ci10ZXNsYS1tb2RlbC15LXBvbGljZS1wYXRyb2wtY2Fyc9IBAA?oc=5","6 top accessories for your Tesla Model Y police patrol cars  Police News","Sat, 27 Apr 2024 07:00:00 GMT"
"Tesla slashed Model Y prices to clear its inventory backlog - Autoblog","https://news.google.com/rss/articles/CBMiYGh0dHBzOi8vd3d3LmF1dG9ibG9nLmNvbS8yMDI0LzA0LzA1L3Rlc2xhLXNsYXNoZWQtbW9kZWwteS1wcmljZXMtdG8tY2xlYXItaXRzLWludmVudG9yeS1iYWNrbG9nL9IBAA?oc=5","Tesla slashed Model Y prices to clear its inventory backlog  Autoblog","Fri, 05 Apr 2024 07:00:00 GMT"
"Tesla makes head-turning move with new long-range Model Y launch: 'Allows you to commute all week without charging' - The Cool Down","https://news.google.com/rss/articles/CBMiT2h0dHBzOi8vd3d3LnRoZWNvb2xkb3duLmNvbS9ncmVlbi1idXNpbmVzcy90ZXNsYS1tb2RlbC15LWxvbmctcmFuZ2UtcndkLWV1cm9wZS_SAQA?oc=5","Tesla makes head-turning move with new long-range Model Y launch: 'Allows you to commute all week without charging'  The Cool Down","Thu, 25 Apr 2024 07:00:00 GMT"
"TopGear Says Fisker Ocean is “Arguably Better Built” Than Tesla Model Y - EV","https://news.google.com/rss/articles/CBMiamh0dHBzOi8vZWxldHJpYy12ZWhpY2xlcy5jb20vZmlza2VyL3RvcGdlYXItc2F5cy1maXNrZXItb2NlYW4taXMtYXJndWFibHktYmV0dGVyLWJ1aWx0LXRoYW4tdGVzbGEtbW9kZWwteS_SAQA?oc=5","TopGear Says Fisker Ocean is “Arguably Better Built” Than Tesla Model Y  EV","Fri, 17 May 2024 07:00:00 GMT"
"Tesla cuts prices by $2000 in US, Model Y back to its lowest price ever - Electrek.co","https://news.google.com/rss/articles/CBMiZWh0dHBzOi8vZWxlY3RyZWsuY28vMjAyNC8wNC8xOS90ZXNsYS1jdXRzLXByaWNlcy1ieS0yMDAwLWluLXVzLW1vZGVsLXktYmFjay10by1pdHMtbG93ZXN0LXByaWNlLWV2ZXIv0gEA?oc=5","Tesla cuts prices by $2000 in US, Model Y back to its lowest price ever  Electrek.co","Fri, 19 Apr 2024 07:00:00 GMT"
"Genesis GV80 luxury electric SUV is coming to take on Tesla Model Y and Porsche Macan EV - Electrek.co","https://news.google.com/rss/articles/CBMiXGh0dHBzOi8vZWxlY3RyZWsuY28vMjAyNC8wNS8yMS9nZW5lc2lzLWd2ODAtbHV4dXJ5LWVsZWN0cmljLXN1di1yaXZhbC10ZXNsYS1tb2RlbC15LXBvcnNjaGUv0gEA?oc=5","Genesis GV80 luxury electric SUV is coming to take on Tesla Model Y and Porsche Macan EV  Electrek.co","Tue, 21 May 2024 07:00:00 GMT"
"EVs On The Cheap: 2024 Tesla Model 3 And Model Y Versus All The Rest - Forbes","https://news.google.com/rss/articles/CBMid2h0dHBzOi8vd3d3LmZvcmJlcy5jb20vc2l0ZXMvYnJvb2tlY3JvdGhlcnMvMjAyNC8wMy8yNC9ldnMtb24tdGhlLWNoZWFwLTIwMjQtdGVzbGEtbW9kZWwtMy1tb2RlbC15LXZlcnN1cy1hbGwtdGhlLXJlc3Qv0gEA?oc=5","EVs On The Cheap: 2024 Tesla Model 3 And Model Y Versus All The Rest  Forbes","Sun, 24 Mar 2024 07:00:00 GMT"
"Tesla's More Affordable Models Could Be Stripped-Down Versions Of Model 3 And Model Y - CarScoops","https://news.google.com/rss/articles/CBMid2h0dHBzOi8vd3d3LmNhcnNjb29wcy5jb20vMjAyNC8wNC90ZXNsYXMtbW9yZS1hZmZvcmRhYmxlLW1vZGVscy1jb3VsZC1iZS1zdHJpcHBlZC1kb3duLXZlcnNpb25zLW9mLW1vZGVsLTMtYW5kLW1vZGVsLXkv0gEA?oc=5","Tesla's More Affordable Models Could Be Stripped-Down Versions Of Model 3 And Model Y  CarScoops","Mon, 29 Apr 2024 07:00:00 GMT"
"Tesla cuts Model Y, X and S prices in the US and says it's ending the referral program - Engadget","https://news.google.com/rss/articles/CBMifGh0dHBzOi8vd3d3LmVuZ2FkZ2V0LmNvbS90ZXNsYS1jdXRzLW1vZGVsLXkteC1hbmQtcy1wcmljZXMtaW4tdGhlLXVzLWFuZC1zYXlzLWl0cy1lbmRpbmctdGhlLXJlZmVycmFsLXByb2dyYW0tMTcyMzExNjYyLmh0bWzSAQA?oc=5","Tesla cuts Model Y, X and S prices in the US and says it's ending the referral program  Engadget","Sat, 20 Apr 2024 07:00:00 GMT"
"10 Biggest News Stories of the Week: Tesla Model X, Model Y Take Cheap Shots at Toyota Tacoma - Cars.com","https://news.google.com/rss/articles/CBMigQFodHRwczovL3d3dy5jYXJzLmNvbS9hcnRpY2xlcy8xMC1iaWdnZXN0LW5ld3Mtc3Rvcmllcy1vZi10aGUtd2Vlay10ZXNsYS1tb2RlbC14LW1vZGVsLXktdGFrZS1jaGVhcC1zaG90cy1hdC10b3lvdGEtdGFjb21hLTQ4MjA0OS_SAYUBaHR0cHM6Ly93d3cuY2Fycy5jb20vYW1wL2FydGljbGVzLzEwLWJpZ2dlc3QtbmV3cy1zdG9yaWVzLW9mLXRoZS13ZWVrLXRlc2xhLW1vZGVsLXgtbW9kZWwteS10YWtlLWNoZWFwLXNob3RzLWF0LXRveW90YS10YWNvbWEtNDgyMDQ5Lw?oc=5","10 Biggest News Stories of the Week: Tesla Model X, Model Y Take Cheap Shots at Toyota Tacoma  Cars.com","Wed, 01 May 2024 07:00:00 GMT"
"Tesla Model Y & Model 3 Cost $10,000 Less Than Average New Car Price - CleanTechnica","https://news.google.com/rss/articles/CBMiZmh0dHBzOi8vY2xlYW50ZWNobmljYS5jb20vMjAyNC8wNC8xMi90ZXNsYS1tb2RlbC15LW1vZGVsLTMtY29zdC0xMDAwMC1sZXNzLXRoYW4tYXZlcmFnZS1uZXctY2FyLXByaWNlL9IBamh0dHBzOi8vY2xlYW50ZWNobmljYS5jb20vMjAyNC8wNC8xMi90ZXNsYS1tb2RlbC15LW1vZGVsLTMtY29zdC0xMDAwMC1sZXNzLXRoYW4tYXZlcmFnZS1uZXctY2FyLXByaWNlL2FtcC8?oc=5","Tesla Model Y & Model 3 Cost $10,000 Less Than Average New Car Price  CleanTechnica","Fri, 12 Apr 2024 07:00:00 GMT"
