序號,類別,題目,選項A,選項B,選項C,選項D,答案
1,不當內容認知,網路上的資訊五花八門，並非都適合各年齡層的使用者，以下哪一種屬於未滿 18 歲適合瀏覽的網站內容？,色情影片。,線上簽賭。,情色文學。,益智遊戲節目。,D
2,不當內容認知,在網路上散布不當的文字或影片內容可能涉及違法行為，以下哪一種行為不違法且合乎禮儀？,虐待動物的圖片、影片。,霸凌他人的言論、影片。,轉貼或販賣色情猥褻圖文影片、自拍猥褻內容。,到美食餐廳經店家同意後，在注意拍攝時間的情況下，進行美食照片拍攝與分享。,D
3,不當內容認知,當我們在瀏覽網頁時，螢幕畫面突然出現「是否已滿18歲」的彈跳視窗，這種狀況代表什麼意思？,該網頁內容可能含有成人內容，禁止未滿18歲使用者觀看。,一種新的網站驗證碼機制。,表示網站已遭受駭客攻擊，點擊該視窗可能會造成設備的危害。,網站正在對使用者的年齡進行調查統計。,A
4,不當內容認知,國小學童使用手機上網的比例已越來越高，為避免學童接觸不適合其年齡觀看的網路內容，家長應當如何因應？,只允許小孩上網觀看動畫影片。,在電腦與手機上安裝過濾軟體，例如教育部網路守護天使程式。,限制小孩上網的時間，小孩只能觀看電視。,採取封閉的態度禁止小孩接受多元的資訊。,B
5,不當內容認知,打擊網路不實資訊的方法，「不包括」以下哪一項？,不查驗。,不製造。,不散播。,不輕信。,A
